{
    "title": "AWB 4 Bahnen",
    "sport": "Rowing",
    "version": "2000",
    "description": "System f√ºr Abteilungen auf 4 Bahnen",
    "capacity": 4,
    "ranges": [
        {
            "from": 2,
            "to": 4,
            "phases": [
                {
                    "label": "Finals",
                    "code": "FNL",
                    "units": [
                        { "code": "R", "label": "Hauptrennen", "rules": [] }
                    ]
                }
            ]
        },
        {
            "from": 5,
            "to": 8,
            "phases": [
                {
                    "label": "Finals",
                    "code": "FNL",
                    "units": [
                        { "code": "A1", "label": "Abteilung 1", "rules": [] },
                        { "code": "A2", "label": "Abteilung 2", "rules": [] }
                    ]
                }
            ]
        },
        {
            "from": 9,
            "to": 12,
            "phases": [
                {
                    "label": "Finals",
                    "code": "FNL",
                    "units": [
                        { "code": "A1", "label": "Abteilung 1", "rules": [] },
                        { "code": "A2", "label": "Abteilung 2", "rules": [] },
                        { "code": "A3", "label": "Abteilung 3", "rules": [] }
                    ]
                }
            ]
        },
        {
            "from": 13,
            "to": 16,
            "phases": [
                {
                    "label": "Finals",
                    "code": "FNL",
                    "units": [
                        { "code": "A1", "label": "Abteilung 1", "rules": [] },
                        { "code": "A2", "label": "Abteilung 2", "rules": [] },
                        { "code": "A3", "label": "Abteilung 3", "rules": [] },
                        { "code": "A4", "label": "Abteilung 4", "rules": [] }
                    ]
                }
            ]
        },
        {
            "from": 17,
            "to": 20,
            "phases": [
                {
                    "label": "Finals",
                    "code": "FNL",
                    "units": [
                        { "code": "A1", "label": "Abteilung 1", "rules": [] },
                        { "code": "A2", "label": "Abteilung 2", "rules": [] },
                        { "code": "A3", "label": "Abteilung 3", "rules": [] },
                        { "code": "A4", "label": "Abteilung 4", "rules": [] },
                        { "code": "A5", "label": "Abteilung 5", "rules": [] }
                    ]
                }
            ]
        },
        {
            "from": 21,
            "to": 24,
            "phases": [
                {
                    "label": "Finals",
                    "code": "FNL",
                    "units": [
                        { "code": "A1", "label": "Abteilung 1", "rules": [] },
                        { "code": "A2", "label": "Abteilung 2", "rules": [] },
                        { "code": "A3", "label": "Abteilung 3", "rules": [] },
                        { "code": "A4", "label": "Abteilung 4", "rules": [] },
                        { "code": "A5", "label": "Abteilung 5", "rules": [] },
                        { "code": "A6", "label": "Abteilung 6", "rules": [] }
                    ]
                }
            ]
        },
        {
            "from": 25,
            "to": 28,
            "phases": [
                {
                    "label": "Finals",
                    "code": "FNL",
                    "units": [
                        { "code": "A1", "label": "Abteilung 1", "rules": [] },
                        { "code": "A2", "label": "Abteilung 2", "rules": [] },
                        { "code": "A3", "label": "Abteilung 3", "rules": [] },
                        { "code": "A4", "label": "Abteilung 4", "rules": [] },
                        { "code": "A5", "label": "Abteilung 5", "rules": [] },
                        { "code": "A6", "label": "Abteilung 6", "rules": [] },
                        { "code": "A7", "label": "Abteilung 7", "rules": [] }
                    ]
                }
            ]
        },
        {
            "from": 29,
            "to": 32,
            "phases": [
                {
                    "label": "Finals",
                    "code": "FNL",
                    "units": [
                        { "code": "A1", "label": "Abteilung 1", "rules": [] },
                        { "code": "A2", "label": "Abteilung 2", "rules": [] },
                        { "code": "A3", "label": "Abteilung 3", "rules": [] },
                        { "code": "A4", "label": "Abteilung 4", "rules": [] },
                        { "code": "A5", "label": "Abteilung 5", "rules": [] },
                        { "code": "A6", "label": "Abteilung 6", "rules": [] },
                        { "code": "A7", "label": "Abteilung 7", "rules": [] },
                        { "code": "A8", "label": "Abteilung 8", "rules": [] }
                    ]
                }
            ]
        },
        {
            "from": 33,
            "to": 36,
            "phases": [
                {
                    "label": "Finals",
                    "code": "FNL",
                    "units": [
                        { "code": "A1", "label": "Abteilung 1", "rules": [] },
                        { "code": "A2", "label": "Abteilung 2", "rules": [] },
                        { "code": "A3", "label": "Abteilung 3", "rules": [] },
                        { "code": "A4", "label": "Abteilung 4", "rules": [] },
                        { "code": "A5", "label": "Abteilung 5", "rules": [] },
                        { "code": "A6", "label": "Abteilung 6", "rules": [] },
                        { "code": "A7", "label": "Abteilung 7", "rules": [] },
                        { "code": "A8", "label": "Abteilung 8", "rules": [] },
                        { "code": "A9", "label": "Abteilung 9", "rules": [] }
                    ]
                }
            ]
        },
        {
            "from": 37,
            "to": 40,
            "phases": [
                {
                    "label": "Finals",
                    "code": "FNL",
                    "units": [
                        { "code": "A1", "label": "Abteilung 1", "rules": [] },
                        { "code": "A2", "label": "Abteilung 2", "rules": [] },
                        { "code": "A3", "label": "Abteilung 3", "rules": [] },
                        { "code": "A4", "label": "Abteilung 4", "rules": [] },
                        { "code": "A5", "label": "Abteilung 5", "rules": [] },
                        { "code": "A6", "label": "Abteilung 6", "rules": [] },
                        { "code": "A7", "label": "Abteilung 7", "rules": [] },
                        { "code": "A8", "label": "Abteilung 8", "rules": [] },
                        { "code": "A9", "label": "Abteilung 9", "rules": [] },
                        { "code": "A10", "label": "Abteilung 10", "rules": [] }
                    ]
                }
            ]
        }
    ]
}
