{
    "title": "Landesmeisterschaften Sachsen",
    "sport": "Rowing",
    "version": "2014",
    "description": "Ausscheidungssystem für die Landesmeisterschaften Sachsen. Direkte Qualifikation vom Vorlauf zum Finale, Finale B ab 10 Booten",
    "capacity": 6,
    "ranges": [
        {
        "from": 2,
        "to": 6,
        "phases": [
            {
            "label": "Finals",
            "code": "FNL",
            "units": [
                { "code": "F", "label": "Finale", "rules": [] }
            ]
            }
        ]
        },
        {
        "from": 7,
        "to": 7,
        "phases": [
            {
            "label": "Vorläufe",
            "code": "HEAT",
            "units": [
                { "code": "V1", "label": "Vorlauf 1", "ruleTexts": { "short": "1-3 -> F" }, "rules": [] },
                { "code": "V2", "label": "Vorlauf 2", "ruleTexts": { "short": "1-2 -> F" }, "rules": [] }
            ]
            },
            {
            "label": "Finals",
            "code": "FNL",
            "units": [
                { "code": "F", "label": "Finale", "rules": [
                    { "source": "V1", "criteria": [ { "select": "rank", "value": 1 } ] },
                    { "source": "V2", "criteria": [ { "select": "rank", "value": 1 } ] },
                    { "source": "V1", "criteria": [ { "select": "rank", "value": 2 } ] },
                    { "source": "V2", "criteria": [ { "select": "rank", "value": 2 } ] },
                    { "source": "V1", "criteria": [ { "select": "rank", "value": 3 } ] }
                ]
                }
            ]
            }
        ]
        },
        {
        "from": 8,
        "to": 9,
        "phases": [
            {
            "label": "Vorläufe",
            "code": "HEAT",
            "units": [
                { "code": "V1", "label": "Vorlauf 1", "ruleTexts": { "short": "1-3 -> F" }, "rules": [] },
                { "code": "V2", "label": "Vorlauf 2", "ruleTexts": { "short": "1-3 -> F" }, "rules": [] }
            ]
            },
            {
            "label": "Finals",
            "code": "FNL",
            "units": [
                { "code": "F", "label": "Finale", "rules": [
                    { "source": "V1", "criteria": [ { "select": "rank", "value": 1 } ] },
                    { "source": "V2", "criteria": [ { "select": "rank", "value": 1 } ] },
                    { "source": "V1", "criteria": [ { "select": "rank", "value": 2 } ] },
                    { "source": "V2", "criteria": [ { "select": "rank", "value": 2 } ] },
                    { "source": "V1", "criteria": [ { "select": "rank", "value": 3 } ] },
                    { "source": "V2", "criteria": [ { "select": "rank", "value": 3 } ] }
                ]
                }
            ]
            }
        ]
        },
        {
        "from": 10,
        "to": 12,
        "phases": [
            {
            "label": "Vorläufe",
            "code": "HEAT",
            "units": [
                { "code": "V1", "label": "Vorlauf 1", "ruleTexts": { "short": "1-3 -> FA, 4-.. -> FB" }, "rules": [] },
                { "code": "V2", "label": "Vorlauf 2", "ruleTexts": { "short": "1-3 -> FA, 4-.. -> FB" }, "rules": [] }
            ]
            },
            {
            "label": "Finals",
            "code": "FNL",
            "units": [
                { "code": "FA", "label": "Finale", "rules": [
                    { "source": "V1", "criteria": [ { "select": "rank", "value": 1 } ] },
                    { "source": "V2", "criteria": [ { "select": "rank", "value": 1 } ] },
                    { "source": "V1", "criteria": [ { "select": "rank", "value": 2 } ] },
                    { "source": "V2", "criteria": [ { "select": "rank", "value": 2 } ] },
                    { "source": "V1", "criteria": [ { "select": "rank", "value": 3 } ] },
                    { "source": "V2", "criteria": [ { "select": "rank", "value": 3 } ] }
                ]
                },
                { "code": "FB", "label": "Finale", "rules": [
                    { "source": "V1", "criteria": [ { "select": "rank", "value": 4 } ] },
                    { "source": "V2", "criteria": [ { "select": "rank", "value": 4 } ] },
                    { "source": "V1", "criteria": [ { "select": "rank", "value": 5 } ] },
                    { "source": "V2", "criteria": [ { "select": "rank", "value": 5 } ] },
                    { "source": "V1", "criteria": [ { "select": "rank", "value": 6 } ] },
                    { "source": "V2", "criteria": [ { "select": "rank", "value": 6 } ] }
                ]
                }
            ]
            }
        ]
        },
        {
        "from": 13,
        "to": 18,
        "phases": [
            {
            "label": "Vorläufe",
            "code": "HEAT",
            "units": [
                { "code": "V1", "label": "Vorlauf 1", "ruleTexts": { "short": "1-2 -> FA, 3-.. -> FB" }, "rules": [] },
                { "code": "V2", "label": "Vorlauf 2", "ruleTexts": { "short": "1-2 -> FA, 3-.. -> FB" }, "rules": [] },
                { "code": "V3", "label": "Vorlauf 3", "ruleTexts": { "short": "1-2 -> FA, 3-.. -> FB" }, "rules": [] }
            ]
            },
            {
            "label": "Finals",
            "code": "FNL",
            "units": [
                { "code": "FA", "label": "Finale A", "rules": [
                    { "source": "V1", "criteria": [ { "select": "rank", "value": 1 } ] },
                    { "source": "V2", "criteria": [ { "select": "rank", "value": 1 } ] },
                    { "source": "V3", "criteria": [ { "select": "rank", "value": 1 } ] },
                    { "source": "V1", "criteria": [ { "select": "rank", "value": 2 } ] },
                    { "source": "V2", "criteria": [ { "select": "rank", "value": 2 } ] },
                    { "source": "V3", "criteria": [ { "select": "rank", "value": 2 } ] }
                ]
                },
                { "code": "FB", "label": "Finale B", "rules": [
                    { "source": "V1", "criteria": [ { "select": "rank", "value": 4 } ] },
                    { "source": "V2", "criteria": [ { "select": "rank", "value": 4 } ] },
                    { "source": "V3", "criteria": [ { "select": "rank", "value": 5 } ] },
                    { "source": "V1", "criteria": [ { "select": "rank", "value": 5 } ] },
                    { "source": "V2", "criteria": [ { "select": "rank", "value": 6 } ] },
                    { "source": "V3", "criteria": [ { "select": "rank", "value": 6 } ] }
                ]
                }
                ]
            }
        ]
        },
        {
        "from": 19,
        "to": 24,
        "phases": [
            {
            "label": "Vorläufe",
            "code": "HEAT",
            "units": [
                { "code": "V1", "label": "Vorlauf 1", "ruleTexts": { "short": "1-2 -> FA, 3-4 -> FB" }, "rules": [] },
                { "code": "V2", "label": "Vorlauf 2", "ruleTexts": { "short": "1-2 -> FA, 3-4 -> FB" }, "rules": [] },
                { "code": "V3", "label": "Vorlauf 3", "ruleTexts": { "short": "1-2 -> FA, 3-4 -> FB" }, "rules": [] }
            ]
            },
            {
            "label": "Finals",
            "code": "FNL",
            "units": [
                { "code": "FA", "label": "Finale A", "rules": [
                    { "source": "V1", "criteria": [ { "select": "rank", "value": 1 } ] },
                    { "source": "V2", "criteria": [ { "select": "rank", "value": 1 } ] },
                    { "source": "V3", "criteria": [ { "select": "rank", "value": 2 } ] },
                    { "source": "V1", "criteria": [ { "select": "rank", "value": 2 } ] },
                    { "source": "V2", "criteria": [ { "select": "rank", "value": 3 } ] },
                    { "source": "V3", "criteria": [ { "select": "rank", "value": 3 } ] }
                ]
                },
                { "code": "FB", "label": "Finale B", "rules": [
                    { "source": "V1", "criteria": [ { "select": "rank", "value": 4 } ] },
                    { "source": "V2", "criteria": [ { "select": "rank", "value": 4 } ] },
                    { "source": "V3", "criteria": [ { "select": "rank", "value": 5 } ] },
                    { "source": "V1", "criteria": [ { "select": "rank", "value": 5 } ] },
                    { "source": "V2", "criteria": [ { "select": "rank", "value": 6 } ] },
                    { "source": "V3", "criteria": [ { "select": "rank", "value": 6 } ] }
                ]
                }
            ]
            }
        ]
        }
    ]
}
