{
    "title": "AWB 6 Bahnen, Vorläufe",
    "sport": "Rowing",
    "version": "0",
    "description": "System für Rennen auf 4 Bahnen mit Vorläufen und direkter Qualifikation für ein Finale (RWR Anhang D und E)",
    "capacity": 6,
    "ranges": [
        {
            "from": 2,
            "to": 6,
            "phases": [
                {
                    "label": "Finals",
                    "code": "FNL",
                    "units": [
                        { "code": "R", "label": "Hauptrennen", "rules": [] }
                    ]
                }
            ]
        },
        {
            "from": 7,
            "to": 7,
            "phases": [
                {
                    "label": "Vorläufe",
                    "code": "HEAT",
                    "units": [
                        { "code": "V1", "label": "Vorlauf 1", "ruleTexts": { "short": "1-3 -> F, 4 -> F or OUT" }, "rules": [] },
                        { "code": "V2", "label": "Vorlauf 2", "ruleTexts": { "short": "1-2 -> F, 3 -> F or OUT" }, "rules": [] }
                    ]
                },
                {
                    "label": "Finals",
                    "code": "FNL",
                    "units": [
                        { "code": "F", "label": "Finale", "rules": [
                                { "option": 1, "order": 1, "source": "V1", "criteria": [    { "select": "rank", "value": 1 } ] },
                                { "option": 1, "order": 2, "source": "V2", "criteria": [    { "select": "rank", "value": 1 } ] },
                                { "option": 1, "order": 3, "source": "V1", "criteria": [    { "select": "rank", "value": 2 } ] },
                                { "option": 1, "order": 4, "source": "V2", "criteria": [    { "select": "rank", "value": 2 } ] },
                                { "option": 1, "order": 5, "source": "V1", "criteria": [    { "select": "rank", "value": 3 } ] },
                                { "option": 1, "order": 6, "source": "HEAT", "criteria": [    { "select": "rev_unit_rank", "value": 1 }, { "select": "time_rank", "value": 1 }] }
                            ]
                        }
                    ]
                }
            ]
        },
        {
            "from": 8,
            "to": 12,
            "phases": [
                {
                    "label": "Vorläufe",
                    "code": "HEAT",
                    "units": [
                        { "code": "V1", "label": "Vorlauf 1", "ruleTexts": { "short": "1-3 -> F" }, "rules": [] },
                        { "code": "V2", "label": "Vorlauf 2", "ruleTexts": { "short": "1-3 -> F" }, "rules": [] }
                    ]
                },
                {
                    "label": "Finals",
                    "code": "FNL",
                    "units": [
                        { "code": "F", "label": "Finale", "rules": [
                                { "option": 1, "order": 1, "source": "V1", "criteria": [    { "select": "rank", "value": 1 } ] },
                                { "option": 1, "order": 2, "source": "V2", "criteria": [    { "select": "rank", "value": 1 } ] },
                                { "option": 1, "order": 3, "source": "V1", "criteria": [    { "select": "rank", "value": 2 } ] },
                                { "option": 1, "order": 4, "source": "V2", "criteria": [    { "select": "rank", "value": 2 } ] },
                                { "option": 1, "order": 5, "source": "V1", "criteria": [    { "select": "rank", "value": 3 } ] },
                                { "option": 1, "order": 6, "source": "V2", "criteria": [    { "select": "rank", "value": 3 } ] }
                            ]
                        }
                    ]
                }
            ]
        },
        {
            "from": 13,
            "to": 18,
            "phases": [
                {
                    "label": "Vorläufe",
                    "code": "HEAT",
                    "units": [
                        { "code": "V1", "label": "Vorlauf 1", "ruleTexts": { "short": "1-2 -> F" }, "rules": [] },
                        { "code": "V2", "label": "Vorlauf 2", "ruleTexts": { "short": "1-2 -> F" }, "rules": [] },
                        { "code": "V3", "label": "Vorlauf 3", "ruleTexts": { "short": "1-2 -> F" }, "rules": [] }
                    ]
                },
                {
                    "label": "Finals",
                    "code": "FNL",
                    "units": [
                        { "code": "F", "label": "Finale", "rules": [
                                { "option": 1, "order": 1, "source": "V1", "criteria": [    { "select": "rank", "value": 1 } ] },
                                { "option": 1, "order": 2, "source": "V2", "criteria": [    { "select": "rank", "value": 1 } ] },
                                { "option": 1, "order": 3, "source": "V3", "criteria": [    { "select": "rank", "value": 1 } ] },
                                { "option": 1, "order": 4, "source": "V1", "criteria": [    { "select": "rank", "value": 2 } ] },
                                { "option": 1, "order": 5, "source": "V2", "criteria": [    { "select": "rank", "value": 2 } ] },
                                { "option": 1, "order": 6, "source": "V3", "criteria": [    { "select": "rank", "value": 2 } ] }
                            ]
                        }
                    ]
                }
            ]
        },
        {
            "from": 19,
            "to": 36,
            "phases": [
                {
                    "label": "Vorläufe",
                    "code": "HEAT",
                    "units": [
                        { "code": "A1", "label": "Abteilung 1", "ruleTexts": { "short": "1 -> F" }, "rules": [] },
                        { "code": "A2", "label": "Abteilung 2", "ruleTexts": { "short": "1 -> F" }, "rules": [] },
                        { "code": "A3", "label": "Abteilung 3", "ruleTexts": { "short": "1 -> F" }, "rules": [] },
                        { "code": "A4", "label": "Abteilung 4", "ruleTexts": { "short": "1 -> F" }, "rules": [] },
                        { "code": "A5", "label": "Abteilung 5", "ruleTexts": { "short": "1 -> F" }, "rules": [] },
                        { "code": "A6", "label": "Abteilung 6", "ruleTexts": { "short": "1 -> F" }, "rules": [] }
                    ]
                },
                {
                    "label": "Finals",
                    "code": "FNL",
                    "units": [
                        { "code": "F", "label": "Finale", "rules": [
                                { "option": 1, "order": 1, "source": "V1", "criteria": [    { "select": "rank", "value": 1 } ] },
                                { "option": 1, "order": 2, "source": "V2", "criteria": [    { "select": "rank", "value": 1 } ] },
                                { "option": 1, "order": 3, "source": "V3", "criteria": [    { "select": "rank", "value": 1 } ] },
                                { "option": 1, "order": 4, "source": "V4", "criteria": [    { "select": "rank", "value": 1 } ] },
                                { "option": 1, "order": 5, "source": "V5", "criteria": [    { "select": "rank", "value": 1 } ] },
                                { "option": 1, "order": 6, "source": "V6", "criteria": [    { "select": "rank", "value": 1 } ] }
                            ]
                        }
                    ]
                }
            ]
        }
    ]
}
